{
  "schemaVersion": 1,
  "scenarioId": "synthetic-targets-v1",
  "provisionalDevelopmentValues": true,
  "seed": 1729,
  "targetDistanceM": 7.5,
  "targetRadiusM": 0.1,
  "targetSpeedMps": 0.2,
  "targetLifetimeSeconds": 10,
  "spawnIntervalSeconds": 0,
  "spawnWidthM": 1.2,
  "spawnHeightM": 0.6,
  "ftHoldSeconds": 0.5,
  "mtMotion": "sine",
  "activeTargetCount": 30,
  "spawnPositionCount": 50,
  "pathSequenceLength": 100000
}
